CO #,Title,Type,Trade,Priority,Status,Project,Submitted,Due,Reviewed,Executed,Requested $,Approved $,Schedule Impact (days),Description,Justification,Linked RFI,Linked Spec,Linked Drawing
CO-001,Additional excavation — unforeseen rock,unforeseen,sitework,high,executed,proj1,2026-02-10,2026-02-18,2026-02-18,2026-02-20,42500,42500,3,Encountered granite bedrock at -6' elevation during excavation for north foundation. Blasting required per geotech recommendation. 3 additional days + rock removal cost.,Unforeseen subsurface conditions. No rock indicated in original geotech report.,RFI-004,,C-101
CO-002,Owner-requested lobby upgrade — premium finishes,owner_directed,finishes,medium,approved,proj1,2026-03-01,2026-03-10,2026-03-15,,128000,115000,0,"Owner requests upgrade of Level 1 lobby finishes from allowance spec to premium imported marble, custom millwork, and designer lighting fixtures.",Owner-directed change per meeting notes 2/28/2026. Design by Davis+Partners.,,Spec 09 30 00,A-101 Rev C
CO-003,MEP redesign — relocated sprinkler main Level 3,design_change,mep,high,under_review,proj1,2026-04-01,2026-04-14,,,18750,0,5,"Sprinkler main relocated 8' east on Level 3 to clear structural beam added by addendum. Requires new hangers, additional pipe run, and pressure rebalance.",Structural beam added per CO-007 conflicts with original sprinkler main routing. Engineer directed reroute per SK-14.,RFI-018,Spec 21 13 00,FP-301
CO-004,Structural beam added — N expansion grid,design_change,steel,critical,executed,proj1,2026-03-20,2026-03-27,2026-03-28,2026-04-01,34200,34200,2,Engineer of record issued SK-12 requiring additional W12x40 beam at north expansion grid to carry additional mechanical unit load added to roof scope.,EOR directed per structural calculation rev. Owner-approved roof unit addition triggered beam requirement.,RFI-012,Spec 05 12 00,S-301 Rev B
CO-005,Asphalt paving — added parking area NE corner,scope_add,sitework,medium,submitted,proj1,2026-04-10,2026-04-25,,,56800,0,4,"Owner requests 28 additional parking stalls in NE corner previously shown as future phase. Full depth asphalt, striping, wheel stops, lighting conduit.",Owner email 4/8/2026 requesting addition to maximize parking for CO.,,Spec 32 12 16,C-201 Rev D
CO-006,Credit — eliminate decorative column wraps,scope_del,finishes,low,approved,proj1,2026-04-05,2026-04-15,2026-04-12,,-14200,-14200,0,Owner elects to eliminate decorative column wraps at lobby columns. Credit to contract for uninstalled material and labor.,Owner value engineering decision. Davis+Partners issued ASI-08 eliminating column wraps from scope.,,Spec 09 69 00,A-301
CO-007,RFI-022 — beam pocket dimension correction,rfi,concrete,high,draft,proj1,,2026-04-28,,,3400,0,1,"Architect issued direction via RFI-022 response requiring beam pocket at Grid C to be 2"" deeper than shown on S-401. Core drill required after pour. Labor and equipment costs.",Architectural direction per RFI-022 response dated 4/16/2026.,RFI-022,,S-401
CO-008,Greenfield — added units B12–B16 scope,scope_add,framing,high,approved,proj2,2026-03-15,2026-03-24,2026-03-25,2026-03-28,218000,218000,10,"Five additional residential units (B12–B16) added to scope. Full framing, MEP rough-in, drywall, and finishes package.",Owner added units per development financing milestone. Signed addendum 3/14/2026.,,,Various